author,title,rating,review,date
125dgs,Service request exception.,3,"First of all, congratulations Ethiotelecom for launching this service even though it is late, it would help the country for modernization of transactions. 

I’ve a question for the developers. The “receive payment” button generates QR code  that works just fine until a certain amount of time is passed. After that it expires and says “service request exception”. How are shops going to print QR code and hang it on their walls for convenience if it expires within just minutes? Or is there any other specific app for only merchants? I need answers asap as I am doing project that will rely on this payment system.",2021-05-17T09:43:15-07:00
daniኮክ,Didn’t work,4,Didn’t open this app please fix this problem,2021-05-15T13:43:29-07:00
EgooMe,This is dam nice.,5,"𝑱𝒖𝒔𝒕 𝒅𝒐𝒘𝒏𝒍𝒐𝒂𝒅𝒆𝒅 𝒊𝒕 𝒂𝒏𝒅 𝒑𝒍𝒂𝒚𝒊𝒏 𝒂𝒓𝒐𝒖𝒏𝒅 𝒘𝒊𝒕𝒉 𝒊𝒕.  𝑾𝒉𝒂𝒕 𝑰 𝒄𝒂𝒏 𝒔𝒖𝒓𝒆𝒍𝒚 𝒔𝒂𝒚 𝒊𝒔, 𝒕𝒉𝒊𝒔 𝑨𝒑𝒑 𝒈𝒐𝒏𝒏𝒂 𝒅𝒐𝒎𝒊𝒏𝒂𝒕𝒆 𝒕𝒉𝒆 𝒎𝒂𝒓𝒌𝒆𝒕 𝒗𝒆𝒓𝒚 𝒔𝒐𝒐𝒏.

𝑻𝒉𝒆 𝑨𝒑𝒑 𝒊𝒔 𝒔𝒐 𝒓𝒆𝒔𝒑𝒐𝒏𝒔𝒊𝒗𝒆 𝒂𝒏𝒅 𝒔𝒎𝒐𝒐𝒕𝒉.

𝑲𝒆𝒆𝒑 𝒖𝒑 𝒕𝒉𝒆 𝒈𝒐𝒐𝒅 𝒘𝒐𝒓𝒌 ✌🏿",2021-05-15T10:58:46-07:00
Mr.Bisrat,Family,1,"It does not work on iOS version, there is a serious problem, this app has been removed, we do not recommend using it.",2021-05-15T04:45:53-07:00
Tedaxius,Not working on iPhone 8+,1,It only shows black screen and crashes on iPhone 8+,2021-05-15T02:52:13-07:00
zemeskel,System internal error,1,"Just downloaded the app and tried to sign up but couldn’t get verification code, system internal error.",2021-05-15T02:39:02-07:00
Kalab9913,There is a room for improvement.,1,"It’s too far from perfect when compared with other apps. Poor interface, glitchy and keeps crashing. But I would still use it because there aren’t any other option in Ethiopia to send money swiftly. Please keep working on it.",2021-05-14T14:29:54-07:00
josy120,The Bihere Lideta,2,"I was curious to test the earlier version of the app, as I have loads of staff which will definitely will use this platform, unfortunately it’s unstable on apple device I wonder how the guy who showed us the could make it to work.",2021-05-14T10:38:49-07:00
user98127654,Can’t open the App,1,"I have downloaded the app, however it fails to open on IOS 14.4.2. It only shows black screen and closes itself.",2021-05-12T11:31:48-07:00
tilworku,Appreciate,5,I am happy to see this.  I was proud to be an employee of this office at one time.  You should be encouraged to use this wonderful application.,2021-05-12T07:34:33-07:00
livealex32,Finally Ethiotelecom supported iOS,5,It is been a while since Ethiotelecom supported this platform and it is good to see,2021-05-11T09:40:36-07:00
